exp_id	date	parent_commit	commit	hypothesis	verdict	primary_metric	val_bpb	memory_gb	status	notes
AL-20260401-046	2026-04-01	d521000	d521000	much of the MLP gain may come from nonlinearity rather than hidden expansion, so a no-expand quadratic token MLP could survive	wrong	final_int8_ttt_lora	1.3981	1.4	discard	2642 steps in 600.0s; artifact 8.69 MB, valid; removing expansion everywhere hurt badly, so the current MLP is not just a cheap quadratic token transform
AL-20260401-047	2026-04-01	d521000	d521000	the model may still want expand-project FFNs, but much less hidden width than the current default	wrong	final_int8_ttt_lora	1.3613	1.7	discard	2249 steps in 600.0s; artifact 10.89 MB, valid; halving MLP width saved bytes but lost too much quality
AL-20260401-048	2026-04-01	d521000	d521000	a structured linear-plus-quadratic token path might replace wide hidden expansion without losing the useful part of the MLP	wrong	final_int8_ttt_lora	1.4045	1.6	discard	2255 steps in 600.0s; artifact 10.81 MB, valid; the no-expand linear-plus-quadratic form was even worse than the blunt no-expand quadratic path
AL-20260401-049	2026-04-01	d521000	d521000	lower mixer-heavy layers may tolerate a lighter no-expand MLP while upper attention layers keep the full dense FFN	partial	final_int8_ttt_lora	1.3533	1.8	discard	2171 steps in 600.0s; artifact 12.30 MB, valid; lower-light plus upper-full was the only Y run that stayed near the frontier, but it still lost clearly
AL-20260401-050	2026-04-01	d521000	d521000	rich per-token refinement may be mainly a top-of-stack job, so only the top layers need a full dense MLP	wrong	final_int8_ttt_lora	1.3611	1.6	discard	2342 steps in 600.0s; artifact 10.87 MB, valid; top-only full MLPs were too weak, so MLP richness is not confined only to the very top
AL-20260401-051	2026-04-01	d521000	d521000	the first lower mixer-heavy blocks may only need sequence mixing, not full per-token FFN work	n_a	final_int8_ttt_lora	n/a	n/a	crash	the first Z run crashed because mixer-only blocks still instantiated dead `mlp_scale` parameters, which tripped DDP unused-parameter detection; fixed later in `97222ab`
AL-20260401-052	2026-04-01	9a3264c	9a3264c	once the lower stack is already mixer-heavy, its FFNs may be largely redundant	wrong	final_int8_ttt_lora	1.3504	1.6	discard	2354 steps in 600.0s; artifact 11.37 MB, valid; removing all four lower FFNs bought many more steps and much smaller size, but quality still fell clearly, so blanket lower-stage FFN removal is too aggressive
AL-20260401-053	2026-04-01	9a3264c	9a3264c	the lower stack may only need a full FFN every other layer rather than after every mixer step	partial	final_int8_ttt_lora	1.3456	1.8	discard	2097 steps in 600.1s; artifact 13.25 MB, valid; alternating lower standard and mixer-only blocks stayed very close to the frontier, so block non-uniformity is real even though the exact pattern did not win
AL-20260401-054	2026-04-01	9a3264c	9a3264c	the lower stack is mainly building structure, while upper layers do the expensive per-token refinement	wrong	final_int8_ttt_lora	1.3535	1.8	discard	2167 steps in 600.2s; artifact 12.31 MB, valid; broadly lightening lower MLPs lost too much quality, so the lower stage is not just cheap structure-building with almost no FFN burden
AL-20260401-055	2026-04-01	9a3264c	9a3264c	capacity may be better concentrated into fewer heavy blocks than paid in every block	partial	final_int8_ttt_lora	1.3442	2.0	discard	1843 steps in 600.2s; artifact 15.38 MB, valid; alternating heavy and light blocks nearly tied the frontier, which suggests periodic capacity concentration is a real block-design clue
AL-20260401-056	2026-04-01	97222ab	97222ab	the upper stack may only need the top three layers as true global-attention reasoners	partial	final_int8_ttt_lora	1.3536	1.8	discard	2101 steps in 600.0s; artifact 14.59 MB, valid; keeping only top-three global layers hurt, but not catastrophically
AL-20260401-057	2026-04-01	97222ab	97222ab	most true global reasoning may happen only in the top two layers	wrong	final_int8_ttt_lora	1.3641	1.8	discard	2162 steps in 600.0s; artifact 14.32 MB, valid; top-two-only global attention removed too much useful upper-stack reasoning
AL-20260401-058	2026-04-01	97222ab	97222ab	if only two global-attention layers remain, top-only routing may help them select the right depth information	wrong	final_int8_ttt_lora	1.3698	2.0	discard	2049 steps in 600.0s; artifact 14.27 MB, valid; adding top-only routing on top of the sparse-upper-attention plan made the collapse worse
AL-20260401-059	2026-04-01	97222ab	97222ab	periodic global refresh may be enough, so interleaving upper attention and lighter refinement blocks could preserve the frontier	partial	final_int8_ttt_lora	1.3454	1.9	discard	2048 steps in 600.0s; artifact 14.57 MB, valid; interleaving upper attention and mixers nearly tied the frontier and was by far the best AA result
AL-20260401-060	2026-04-01	97222ab	97222ab	the model may want one final dominant global reasoner layer more than many medium-strength upper attention layers	wrong	final_int8_ttt_lora	1.3797	1.8	discard	2268 steps in 600.0s; artifact 14.06 MB, valid; collapsing the upper stack into one final reasoner layer failed hard
AL-20260401-061	2026-04-01	97222ab	97222ab	the first two lower mixer blocks may be repetitive enough that sharing their weights saves bytes without losing much function	wrong	final_int8_ttt_lora	1.3511	1.9	discard	1932 steps in 600.0s; artifact 13.67 MB, valid; lower-two sharing was the cleanest AB survivor but still lost clearly to the frontier
AL-20260401-062	2026-04-01	97222ab	97222ab	the whole lower mixer stage may be repeated refinement rather than four distinct computations, so all four lower blocks could share weights	wrong	final_int8_ttt_lora	1.3644	1.9	discard	1987 steps in 600.0s; artifact 10.87 MB, valid; sharing the full lower mixer stage cost too much quality
AL-20260401-063	2026-04-01	97222ab	97222ab	the top two attention blocks may repeat a similar refinement computation and could share most of their weights	wrong	final_int8_ttt_lora	1.3539	2.0	discard	1938 steps in 600.0s; artifact 13.38 MB, valid; upper two-layer sharing also lost, so the top attention stage is not trivially repetitive
AL-20260401-064	2026-04-01	97222ab	97222ab	if lower-stage sharing is viable, the saved bytes are better spent on a wider mixer than simply banked	wrong	final_int8_ttt_lora	1.3642	2.0	discard	1948 steps in 600.0s; artifact 10.95 MB, valid; sharing plus wider mixer did not recover the lost function
AL-20260401-065	2026-04-01	97222ab	97222ab	if lower-stage sharing is viable, the saved budget is better spent on one extra upper reasoning step	wrong	final_int8_ttt_lora	1.3577	2.1	discard	1768 steps in 600.0s; artifact 12.42 MB, valid; sharing plus one extra upper layer also stayed behind the frontier
AL-20260401-066	2026-04-01	9a3264c	9a3264c	top-only selective FFN compute can preserve quality while avoiding uniform heavy refinement at the very top	wrong	final_int8_ttt_lora	1.3614	2.1	discard	1791 steps in 600.0s; artifact 15.90 MB, valid; top-only heavy FFN routing was the least bad AC run, but it still lost clearly, so token-selective FFN compute is not immediately viable even in the safest placement
AL-20260401-067	2026-04-01	9a3264c	9a3264c	the upper stack may benefit from repeated token-selective FFN refinement rather than uniform FFNs everywhere	wrong	final_int8_ttt_lora	1.3905	2.2	discard	1660 steps in 600.4s; artifact 17.14 MB, invalid; spreading token-selective FFN routing across the upper stack degraded badly and also broke the size cap
AL-20260401-068	2026-04-01	9a3264c	9a3264c	many tokens may only need a cheap local-ish update, while a routed minority needs full global attention	wrong	final_int8_ttt_lora	1.4870	2.1	discard	1618 steps in 600.2s; artifact 15.86 MB, valid; token-selective heavy attention collapsed badly, so the upper stack does not tolerate naive sparse global reasoning in this form
AL-20260401-069	2026-04-01	9a3264c	9a3264c	the model may want a small subset of important tokens to receive both heavy attention and heavy FFN updates together	wrong	final_int8_ttt_lora	1.4935	2.3	discard	1439 steps in 600.2s; artifact 17.76 MB, invalid; the joint heavy-token path was catastrophic, so this first token-selective compute design is badly mismatched to the current frontier
AL-20260401-070	2026-04-01	9a3264c	9a3264c	if token-selective compute is the right principle, a crude importance proxy like token norm should still show some signal	wrong	final_int8_ttt_lora	1.5095	2.3	discard	1463 steps in 600.2s; artifact 17.74 MB, invalid; the norm router was even worse, which suggests the failure is in the principle or implementation shape, not just the learned router
AL-20260401-071	2026-04-01	9a3264c	9a3264c	a learned-slot latent workspace may preserve most top-of-stack global reasoning while reducing token-space burden	n_a	final_int8_ttt_lora	n/a	n/a	crash	the first latent upper-reasoner candidate crashed immediately after startup before producing a metric; the AD family remains operationally unresolved rather than scientifically judged
AL-20260401-076	2026-04-01	9a3264c	9a3264c	upper attention layers may contain shareable structure if each layer still gets a small learned delta	wrong	final_int8_ttt_lora	1.3485	2.0	discard	1913 steps in 600.0s; artifact 13.74 MB, valid; pairwise upper-attention sharing plus deltas was survivable but still clearly behind the frontier
AL-20260401-077	2026-04-01	9a3264c	9a3264c	lower mixer blocks may be more repetitive and therefore better candidates for structured sharing	partial	final_int8_ttt_lora	1.3464	2.0	discard	1899 steps in 600.3s; artifact 14.28 MB, valid; pairwise lower-mixer sharing plus deltas stayed close to the frontier, which revives compression-native sharing in a narrower lower-stage form
AL-20260401-078	2026-04-01	9a3264c	9a3264c	upper FFNs may share a large common basis while still needing only small layer-specific corrections	wrong	final_int8_ttt_lora	1.3551	2.0	discard	1887 steps in 600.2s; artifact 13.26 MB, valid; upper-FFN sharing with deltas still lost clearly, so FFNs remain a weak sharing target
AL-20260401-079	2026-04-01	9a3264c	9a3264c	attention redundancy may span more than layer pairs if small deltas preserve layer identity	wrong	final_int8_ttt_lora	1.3504	2.0	discard	1908 steps in 600.2s; artifact 13.74 MB, valid; broader upper-attention sharing was worse than pairwise sharing, so structured sharing needs to stay local rather than span a whole upper band
AL-20260401-080	2026-04-01	9a3264c	9a3264c	sharing may be a reallocation mechanism rather than a direct quality win by itself	partial	final_int8_ttt_lora	1.3471	2.0	discard	1875 steps in 600.2s; artifact 14.34 MB, valid; lower-mixer sharing plus a wider mixer stayed close, which supports the idea that careful sharing may be useful mainly when paired with reallocation
